{
  "protocol": "tezuri.site-proof-run",
  "version": 1,
  "runId": "proof:synthetic-1",
  "status": "passed",
  "startedAt": "2026-08-13T15:00:00Z",
  "completedAt": "2026-08-13T15:02:00Z",
  "workspaceRevision": "working:synthetic-1",
  "sourceDigest": "sha256:ffffffffffffffffffffffffffffffffffffffffffffffffffffffffffffffff",
  "progress": {
    "state": "passed",
    "completedCommands": 1,
    "totalCommands": 1,
    "currentCommandId": null
  },
  "result": {
    "succeeded": true,
    "commands": [
      {
        "id": "site-test",
        "executable": "npm",
        "arguments": ["test"],
        "status": "passed",
        "exitCode": 0,
        "timedOut": false,
        "durationMilliseconds": 1200,
        "standardOutput": "Synthetic proof passed.",
        "standardError": "",
        "standardOutputTruncated": false,
        "standardErrorTruncated": false,
        "outputDirectory": "dist",
        "outputDirectoryExists": true
      }
    ],
    "findings": [],
    "artifacts": [
      {
        "id": "artifact:site",
        "kind": "rendered-site",
        "path": "dist",
        "digest": "sha256:aaaaaaaaaaaaaaaaaaaaaaaaaaaaaaaaaaaaaaaaaaaaaaaaaaaaaaaaaaaaaaaa",
        "bytes": 4096,
        "mediaType": "text/html"
      }
    ]
  }
}
